{
  "kind": "blender-bonsai-request",
  "contractVersion": "0.1.0",
  "requestId": "blender-bonsai-ifc-geometry-demo-001",
  "action": "ifc-geometry-demo",
  "readOnly": true,
  "sourceKind": "manual-sample",
  "artifacts": {
    "responsePath": "samples/responses/ifc-geometry-demo.result.json",
    "ifcPath": "out/request_ifc_geometry_demo.ifc",
    "ifcSnapshotPath": "out/request_ifc_geometry_property_snapshot.json",
    "ifcTakeoffPath": "samples/reports/ifc-geometry-demo.takeoff.json",
    "modelReportJsonPath": "samples/reports/ifc-geometry-demo.model-report.json",
    "modelReportMarkdownPath": "samples/reports/ifc-geometry-demo.model-report.md"
  },
  "options": {
    "reuseExistingArtifactsIfPresent": true,
    "notes": "Create a minimal IFC with simple body/axis representations, then extract placement and representation diagnostics."
  }
}
